{
  "schemaVersion": 1,
  "completion": {
    "selector": "#lesson",
    "attribute": "data-pep-complete",
    "equals": "true"
  },
  "progress": {
    "selector": "#prog-text",
    "text": "^Activities done: (\\d+) of \\1"
  },
  "routes": {
    "success": [
      {
        "do": "click",
        "selector": "label[for=\"pred-1-deleted\"]"
      },
      {
        "do": "click",
        "selector": "label[for=\"conf-P-medium\"]"
      },
      {
        "do": "click",
        "selector": "#predict-check-1"
      },
      {
        "do": "expectText",
        "selector": "#current-feedback",
        "text": "Practice prediction, not scored"
      },
      {
        "do": "click",
        "selector": "#next"
      },
      {
        "do": "expectDisabled",
        "selector": "#next"
      },
      {
        "do": "click",
        "selector": "#sim-2-ref > summary"
      },
      {
        "do": "click",
        "selector": "[data-cmd=\"revert\"][data-step-n=\"2\"]"
      },
      {
        "do": "click",
        "selector": "[data-cmd=\"push\"][data-step-n=\"2\"]"
      },
      {
        "do": "expectEnabled",
        "selector": "#next"
      },
      {
        "do": "click",
        "selector": "#next"
      },
      {
        "do": "expectDisabled",
        "selector": "#next"
      },
      {
        "do": "click",
        "selector": "#sim-3-ref > summary"
      },
      {
        "do": "click",
        "selector": "[data-cmd=\"soft\"][data-step-n=\"3\"]"
      },
      {
        "do": "expectEnabled",
        "selector": "#next"
      },
      {
        "do": "click",
        "selector": "#next"
      },
      {
        "do": "click",
        "selector": "label[for=\"ans-A-revert\"]"
      },
      {
        "do": "click",
        "selector": "label[for=\"conf-A-medium\"]"
      },
      {
        "do": "click",
        "selector": "#apply-check-A"
      },
      {
        "do": "expectAttribute",
        "selector": "#current-feedback",
        "attribute": "data-pep-result",
        "equals": "correct"
      },
      {
        "do": "click",
        "selector": "#next"
      }
    ],
    "wrongFirst": [
      {
        "do": "click",
        "selector": "label[for=\"pred-1-deleted\"]"
      },
      {
        "do": "click",
        "selector": "label[for=\"conf-P-medium\"]"
      },
      {
        "do": "click",
        "selector": "#predict-check-1"
      },
      {
        "do": "expectText",
        "selector": "#current-feedback",
        "text": "Practice prediction, not scored"
      },
      {
        "do": "click",
        "selector": "#next"
      },
      {
        "do": "expectDisabled",
        "selector": "#next"
      },
      {
        "do": "click",
        "selector": "#sim-2-ref > summary"
      },
      {
        "do": "click",
        "selector": "[data-cmd=\"revert\"][data-step-n=\"2\"]"
      },
      {
        "do": "click",
        "selector": "[data-cmd=\"push\"][data-step-n=\"2\"]"
      },
      {
        "do": "expectEnabled",
        "selector": "#next"
      },
      {
        "do": "click",
        "selector": "#next"
      },
      {
        "do": "expectDisabled",
        "selector": "#next"
      },
      {
        "do": "click",
        "selector": "#sim-3-ref > summary"
      },
      {
        "do": "click",
        "selector": "[data-cmd=\"soft\"][data-step-n=\"3\"]"
      },
      {
        "do": "expectEnabled",
        "selector": "#next"
      },
      {
        "do": "click",
        "selector": "#next"
      },
      {
        "do": "click",
        "selector": "label[for=\"ans-A-hard\"]"
      },
      {
        "do": "click",
        "selector": "label[for=\"conf-A-medium\"]"
      },
      {
        "do": "click",
        "selector": "#apply-check-A"
      },
      {
        "do": "expectAttribute",
        "selector": "#current-feedback",
        "attribute": "data-pep-result",
        "equals": "retry"
      },
      {
        "do": "expectDisabled",
        "selector": "#next"
      },
      {
        "do": "click",
        "selector": "label[for=\"ans-B-c10\"]"
      },
      {
        "do": "click",
        "selector": "label[for=\"conf-B-low\"]"
      },
      {
        "do": "click",
        "selector": "#apply-check-B"
      },
      {
        "do": "expectAttribute",
        "selector": "#current-feedback",
        "attribute": "data-pep-result",
        "equals": "correct-second"
      },
      {
        "do": "click",
        "selector": "#next"
      }
    ],
    "wrongTwice": [
      {
        "do": "click",
        "selector": "label[for=\"pred-1-deleted\"]"
      },
      {
        "do": "click",
        "selector": "label[for=\"conf-P-medium\"]"
      },
      {
        "do": "click",
        "selector": "#predict-check-1"
      },
      {
        "do": "expectText",
        "selector": "#current-feedback",
        "text": "Practice prediction, not scored"
      },
      {
        "do": "click",
        "selector": "#next"
      },
      {
        "do": "expectDisabled",
        "selector": "#next"
      },
      {
        "do": "click",
        "selector": "#sim-2-ref > summary"
      },
      {
        "do": "click",
        "selector": "[data-cmd=\"revert\"][data-step-n=\"2\"]"
      },
      {
        "do": "click",
        "selector": "[data-cmd=\"push\"][data-step-n=\"2\"]"
      },
      {
        "do": "expectEnabled",
        "selector": "#next"
      },
      {
        "do": "click",
        "selector": "#next"
      },
      {
        "do": "expectDisabled",
        "selector": "#next"
      },
      {
        "do": "click",
        "selector": "#sim-3-ref > summary"
      },
      {
        "do": "click",
        "selector": "[data-cmd=\"soft\"][data-step-n=\"3\"]"
      },
      {
        "do": "expectEnabled",
        "selector": "#next"
      },
      {
        "do": "click",
        "selector": "#next"
      },
      {
        "do": "click",
        "selector": "label[for=\"ans-A-hard\"]"
      },
      {
        "do": "click",
        "selector": "label[for=\"conf-A-medium\"]"
      },
      {
        "do": "click",
        "selector": "#apply-check-A"
      },
      {
        "do": "expectAttribute",
        "selector": "#current-feedback",
        "attribute": "data-pep-result",
        "equals": "retry"
      },
      {
        "do": "expectDisabled",
        "selector": "#next"
      },
      {
        "do": "click",
        "selector": "label[for=\"ans-B-c8\"]"
      },
      {
        "do": "click",
        "selector": "label[for=\"conf-B-low\"]"
      },
      {
        "do": "click",
        "selector": "#apply-check-B"
      },
      {
        "do": "expectAttribute",
        "selector": "#current-feedback",
        "attribute": "data-pep-result",
        "equals": "settled"
      },
      {
        "do": "click",
        "selector": "#next"
      },
      {
        "do": "expectText",
        "selector": "#prog-text",
        "text": "settled, not correct"
      }
    ]
  },
  "simulatorEdges": [
    {
      "name": "sim 2: hard then push leaves goal undone open",
      "actions": [
        {
          "do": "click",
          "selector": "label[for=\"pred-1-deleted\"]"
        },
        {
          "do": "click",
          "selector": "label[for=\"conf-P-medium\"]"
        },
        {
          "do": "click",
          "selector": "#predict-check-1"
        },
        {
          "do": "expectText",
          "selector": "#current-feedback",
          "text": "Practice prediction, not scored"
        },
        {
          "do": "click",
          "selector": "#next"
        },
        {
          "do": "expectDisabled",
          "selector": "#next"
        },
        {
          "do": "click",
          "selector": "#sim-2-ref > summary"
        },
        {
          "do": "click",
          "selector": "[data-cmd=\"hard\"][data-step-n=\"2\"]"
        },
        {
          "do": "click",
          "selector": "[data-cmd=\"push\"][data-step-n=\"2\"]"
        },
        {
          "do": "expectText",
          "selector": "#sim-2-log",
          "text": "rejected"
        },
        {
          "do": "expectDisabled",
          "selector": "#next"
        }
      ]
    },
    {
      "name": "sim 2: soft then push leaves goal shared open",
      "actions": [
        {
          "do": "click",
          "selector": "label[for=\"pred-1-deleted\"]"
        },
        {
          "do": "click",
          "selector": "label[for=\"conf-P-medium\"]"
        },
        {
          "do": "click",
          "selector": "#predict-check-1"
        },
        {
          "do": "expectText",
          "selector": "#current-feedback",
          "text": "Practice prediction, not scored"
        },
        {
          "do": "click",
          "selector": "#next"
        },
        {
          "do": "expectDisabled",
          "selector": "#next"
        },
        {
          "do": "click",
          "selector": "#sim-2-ref > summary"
        },
        {
          "do": "click",
          "selector": "[data-cmd=\"soft\"][data-step-n=\"2\"]"
        },
        {
          "do": "click",
          "selector": "[data-cmd=\"push\"][data-step-n=\"2\"]"
        },
        {
          "do": "expectText",
          "selector": "#sim-2-log",
          "text": "rejected"
        },
        {
          "do": "expectDisabled",
          "selector": "#next"
        }
      ]
    },
    {
      "name": "sim 2: revert leaves goal shared open",
      "actions": [
        {
          "do": "click",
          "selector": "label[for=\"pred-1-deleted\"]"
        },
        {
          "do": "click",
          "selector": "label[for=\"conf-P-medium\"]"
        },
        {
          "do": "click",
          "selector": "#predict-check-1"
        },
        {
          "do": "expectText",
          "selector": "#current-feedback",
          "text": "Practice prediction, not scored"
        },
        {
          "do": "click",